### ISSUE TITLE
setting up bgp bro

### ISSUE THREAD

**Issue by 230500226** [230500226/NSS370S#2]
trying to setup bgp from ubuntu

**Comment by 230500226** [comment]
Trying

Method: POST

URL: 
```
http://10.0.1.2:8181/rests/data/openconfig-network-instance:network-instances/network-instance=global-bgp/protocols
```

Body (XML):
```
<protocol xmlns="http://openconfig.net/yang/network-instance">
 <name>bgp-to-r1</name>
 <identifier xmlns:x="http://openconfig.net/yang/policy-types">x:BGP</identifier>
 <bgp xmlns="urn:opendaylight:params:xmlns:yang:bgp-openconfig-extensions">
  <global>
   <config>
    <router-id>10.0.1.2</router-id>
    <as>65000</as>
   </config>
  </global>
 </bgp>
</protocol>
```

**Comment by 230500226** [comment]
this is my ip addr
```
ubuntu@ubuntu-VirtualBox:~$ ip addr
1: lo: <LOOPBACK,UP,LOWER_UP> mtu 65536 qdisc noqueue state UNKNOWN group default qlen 1000
    link/loopback 00:00:00:00:00:00 brd 00:00:00:00:00:00
    inet 127.0.0.1/8 scope host lo
       valid_lft forever preferred_lft forever
    inet6 ::1/128 scope host noprefixroute 
       valid_lft forever preferred_lft forever
2: enp0s8: <BROADCAST,MULTICAST,UP,LOWER_UP> mtu 1500 qdisc fq_codel state UP group default qlen 1000
    link/ether 08:00:27:75:a0:ee brd ff:ff:ff:ff:ff:ff
    inet 155.238.185.31/24 brd 155.238.185.255 scope global dynamic noprefixroute enp0s8
       valid_lft 258762sec preferred_lft 258762sec
    inet6 fe80::aa84:b710:1a4e:cbd0/64 scope link noprefixroute 
       valid_lft forever preferred_lft forever
3: enp0s3: <BROADCAST,MULTICAST,UP,LOWER_UP> mtu 1500 qdisc fq_codel state UP group default qlen 1000
    link/ether 08:00:27:f3:3c:c8 brd ff:ff:ff:ff:ff:ff
    inet 10.0.0.1/30 scope global enp0s3
       valid_lft forever preferred_lft forever
```

**Comment by 230500226** [comment]
Suggested from SAM

Check if the default Policy Exist 
 
GET: http://192.168.47.132:8181/rests/data/openconfig-routing-policy:routing-policy/openconfig-routing-policy:policy-definitions
Response from ODL: ODL will return the default policy if it exists.

**Comment by 230500226** [comment]
1. Configure a new protocol instance
POST: 
```
http://192.168.47.132:8181/rests/data/openconfig-network-instance:network-instances/network-instance=global-bgp/protocols
```
BODY:
```
<protocol xmlns="http://openconfig.net/yang/network-instance">
<name>bgp-to-r1</name>
<identifier xmlns:x="http://openconfig.net/yang/policy-types">x:BGP</identifier>
<bgp xmlns="urn:opendaylight:params:xml:ns:yang:bgp:openconfig-extensions">
<global>
<config>
<router-id>192.168.47.132</router-id>
<!-- <router-id>192.168.47.129</router-id> -->
<as>65002</as>
</config>
<apply-policy>
<config>
<default-export-policy>REJECT-ROUTE</default-export-policy>
<default-import-policy>REJECT-ROUTE</default-import-policy>
<import-policy>default-odl-import-policy</import-policy>
<export-policy>default-odl-export-policy</export-policy>
</config>
</apply-policy>
</global>
</bgp>
</protocol>
```

**Comment by 230500226** [comment]
3. BGP ODL Server port binding
PUT: 
```
http://192.168.47.132:8181/rests/data/odl-bgp-peer-acceptor-config:bgp-peer-acceptor-config=default
```
BODY:
```
<bgp-peer-acceptor-config xmlns="urn:opendaylight:params:xml:ns:yang:odl-bgp-peer-acceptor-config">
<config-name>default</config-name>
<binding-address>0.0.0.0</binding-address>
<binding-port>1790</binding-port>
</bgp-peer-acceptor-config>
```
NOTE:
At this point, you can verify if ODL is listening on 1790 by opening a terminal window on the host where ODL is running
and issuing:
# 1) Best: socket summary with process name
sudo ss -ltnp | grep :1790
# or with a filter:
sudo ss -ltnp '( sport = :1790 )'
# 2) Alternative
sudo lsof -iTCP:1790 -sTCP:LISTEN -Pn
# 3) Old-school
sudo netstat -plnt | grep :1790
What should the expected output looks like:
LISTEN 0 128 192.168.47.129:1790 0.0.0.0:* users:(("java",pid=1234,fd=...))
From VyOS (or another host)
vyos@VyOSR1:~$ nc -vz 192.168.47.132 1790
Output:
Connection to 192.168.47.132 1790 port [tcp/*] succeeded!

**Comment by 230500226** [comment]
4. BGP Peering add the VyOS1 router as neighbor
POST: 
```
http://192.168.47.132:8181/rests/data/openconfig-network-instance:network-instances/network-instance=global-bgp/openconfig-network-instance:protocols/protocol=openconfig-policy-types:BGP,bgp-
to-r1/bgp-openconfig-extensions:bgp/neighbors
```
BODY:
```
<neighbor xmlns="urn:opendaylight:params:xml:ns:yang:bgp:openconfig-extensions" >
<neighbor-address>192.168.47.135</neighbor-address>
<timers>
<config>
<hold-time>90</hold-time>
<connect-retry>10</connect-retry>
</config>
</timers>
<transport>
<config>
<remote-port>1790</remote-port>
<!--<local-address>192.0.2.5</local-address>-->
<passive-mode>true</passive-mode> <!-- ODL won't initiate -->
</config>
</transport>
<!-- <odlpol:neighbor-role>rr-client</odlpol:neighbor-role> -->
<config>
<peer-type>INTERNAL</peer-type>
<peer-as>65002</peer-as>
</config>
<afi-safis>
<afi-safi>
<afi-safi-name xmlns:x="http://openconfig.net/yang/bgp-types">x:IPV4-UNICAST</afi-safi-name>
<config>
<afi-safi-name xmlns:x="http://openconfig.net/yang/bgp-types">x:IPV4-UNICAST</afi-safi-name>
<enabled>true</enabled>
</config>
</afi-safi>
</afi-safis>
</neighbor>
```

**Comment by 230500226** [comment]
6. Configure route reflector
PUT: 
```
http://192.168.47.132:8181/rests/data/openconfig-network-instance:network-instances/network-instance=global-bgp/openconfig-network-instance:protocols/protocol=openconfig-policy-types:BGP,bgp-
to-r1/bgp-openconfig-extensions:bgp/neighbors/neighbor=192.168.47.135/route-reflector
```
BODY:
```
<route-reflector xmlns="urn:opendaylight:params:xml:ns:yang:bgp:openconfig-extensions">
<config>
<route-reflector-client>true</route-reflector-client>
<!-- optional but recommended: set an explicit cluster-id -->
<route-reflector-cluster-id>192.168.47.132</route-reflector-cluster-id>
</config>
</route-reflector>
```

**Comment by 230500226** [comment]
Check for RIB Policy Config
GET http://192.168.47.132:8181/rests/data/openconfig-routing-policy:routing-policy?content=config

**Comment by 230500226** [comment]
2. Verify the new protocol instance
GET:
 ```
http://192.168.47.132:8181/rests/data/bgp-rib:bgp-rib/rib=bgp-to-r1?content=nonconfig
```

**Comment by 230500226** [comment]
ubuntu cant ping vyos
```
ubuntu@ubuntu-VirtualBox:~$ ip addr show
1: lo: <LOOPBACK,UP,LOWER_UP> mtu 65536 qdisc noqueue state UNKNOWN group default qlen 1000
    link/loopback 00:00:00:00:00:00 brd 00:00:00:00:00:00
    inet 127.0.0.1/8 scope host lo
       valid_lft forever preferred_lft forever
    inet6 ::1/128 scope host noprefixroute 
       valid_lft forever preferred_lft forever
2: enp0s8: <BROADCAST,MULTICAST,UP,LOWER_UP> mtu 1500 qdisc fq_codel state UP group default qlen 1000
    link/ether 08:00:27:75:a0:ee brd ff:ff:ff:ff:ff:ff
    inet 10.0.3.15/24 brd 10.0.3.255 scope global dynamic noprefixroute enp0s8
       valid_lft 85796sec preferred_lft 85796sec
    inet6 fe80::aa84:b710:1a4e:cbd0/64 scope link noprefixroute 
       valid_lft forever preferred_lft forever
3: enp0s3: <BROADCAST,MULTICAST,UP,LOWER_UP> mtu 1500 qdisc fq_codel state UP group default qlen 1000
    link/ether 08:00:27:f3:3c:c8 brd ff:ff:ff:ff:ff:ff
    inet 192.168.56.101/24 brd 192.168.56.255 scope global dynamic noprefixroute enp0s3
       valid_lft 596sec preferred_lft 596sec
    inet6 fe80::a00:27ff:fef3:3cc8/64 scope link 
       valid_lft forever preferred_lft forever
4: enp0s9: <NO-CARRIER,BROADCAST,MULTICAST,UP> mtu 1500 qdisc fq_codel state DOWN group default qlen 1000
    link/ether 08:00:27:9f:25:27 brd ff:ff:ff:ff:ff:ff
ubuntu@ubuntu-VirtualBox:~$ ip route show
default via 10.0.3.2 dev enp0s8 proto dhcp src 10.0.3.15 metric 20101 
10.0.3.0/24 dev enp0s8 proto kernel scope link src 10.0.3.15 metric 101 
192.168.56.0/24 dev enp0s3 proto kernel scope link src 192.168.56.101 metric 100 
ubuntu@ubuntu-VirtualBox:~$ arp -n
Address                  HWtype  HWaddress           Flags Mask            Iface
10.0.3.2                 ether   52:54:00:12:35:02   C                     enp0s8
192.168.56.105           ether   08:00:27:8b:b3:be   C                     enp0s3
192.168.56.100           ether   08:00:27:77:79:69   C                     enp0s3
ubuntu@ubuntu-VirtualBox:~$ ping 192.168.56.105
PING 192.168.56.105 (192.168.56.105) 56(84) bytes of data.
From 192.168.56.101 icmp_seq=28 Destination Host Unreachable
From 192.168.56.101 icmp_seq=29 Destination Host Unreachable
From 192.168.56.101 icmp_seq=30 Destination Host Unreachable
From 192.168.56.101 icmp_seq=31 Destination Host Unreachable
From 192.168.56.101 icmp_seq=32 Destination Host Unreachable
From 192.168.56.101 icmp_seq=33 Destination Host Unreachable
^C
--- 192.168.56.105 ping statistics ---
36 packets transmitted, 0 received, +6 errors, 100% packet loss, time 35869ms
pipe 4
ubuntu@ubuntu-VirtualBox:~$ 
```

**Comment by 230500226** [comment]
further trouble shooting
```
ubuntu@ubuntu-VirtualBox:~$ sudo ip neigh flush 192.168.56.105 dev enp0s3
ubuntu@ubuntu-VirtualBox:~$ ip neigh show | grep 192.168.56.105
192.168.56.105 dev enp0s3 lladdr 08:00:27:8b:b3:be REACHABLE 
ubuntu@ubuntu-VirtualBox:~$ ip neigh show | grep 192.168.56.105 || true
192.168.56.105 dev enp0s3 lladdr 08:00:27:8b:b3:be REACHABLE 
ubuntu@ubuntu-VirtualBox:~$ ping -c 5 192.168.56.105
PING 192.168.56.105 (192.168.56.105) 56(84) bytes of data.

--- 192.168.56.105 ping statistics ---
5 packets transmitted, 0 received, 100% packet loss, time 4115ms

ubuntu@ubuntu-VirtualBox:~$ 
```

```
ubuntu@ubuntu-VirtualBox:~$ sudo tcpdump -n -i enp0s3 arp
[sudo] password for ubuntu: 
Sorry, try again.
[sudo] password for ubuntu: 
tcpdump: verbose output suppressed, use -v[v]... for full protocol decode
listening on enp0s3, link-type EN10MB (Ethernet), snapshot length 262144 bytes
21:56:48.585060 ARP, Request who-has 192.168.56.105 tell 192.168.56.101, length 28
21:56:49.609085 ARP, Request who-has 192.168.56.105 tell 192.168.56.101, length 28
21:56:50.633076 ARP, Request who-has 192.168.56.105 tell 192.168.56.101, length 28
21:56:51.386352 ARP, Request who-has 192.168.56.101 tell 192.168.56.105, length 46
21:56:51.386364 ARP, Reply 192.168.56.101 is-at 08:00:27:f3:3c:c8, length 28
21:56:51.511726 ARP, Request who-has 192.168.56.103 (08:00:27:c1:70:70) tell 192.168.56.1, length 46
21:56:51.511773 ARP, Reply 192.168.56.103 is-at 08:00:27:c1:70:70, length 46
21:56:52.413204 ARP, Request who-has 192.168.56.101 tell 192.168.56.105, length 46
21:56:52.413228 ARP, Reply 192.168.56.101 is-at 08:00:27:f3:3c:c8, length 28
21:56:53.434905 ARP, Request who-has 192.168.56.101 tell 192.168.56.105, length 46
21:56:53.434915 ARP, Reply 192.168.56.101 is-at 08:00:27:f3:3c:c8, length 28
21:56:57.171127 ARP, Request who-has 192.168.56.101 tell 192.168.56.105, length 46
21:56:57.171141 ARP, Reply 192.168.56.101 is-at 08:00:27:f3:3c:c8, length 28
21:57:02.409082 ARP, Request who-has 192.168.56.105 tell 192.168.56.101, length 28
21:57:03.433044 ARP, Request who-has 192.168.56.105 tell 192.168.56.101, length 28
21:57:04.457086 ARP, Request who-has 192.168.56.105 tell 192.168.56.101, length 28
21:57:08.244332 ARP, Request who-has 192.168.56.105 tell 192.168.56.101, length 28
21:57:09.257070 ARP, Request who-has 192.168.56.105 tell 192.168.56.101, length 28
21:57:10.281056 ARP, Request who-has 192.168.56.105 tell 192.168.56.101, length 28
21:57:10.285393 ARP, Reply 192.168.56.105 is-at 08:00:27:8b:b3:be, length 46
21:57:18.524265 ARP, Request who-has 192.168.56.101 tell 192.168.56.105, length 46
21:57:18.524281 ARP, Reply 192.168.56.101 is-at 08:00:27:f3:3c:c8, length 28
21:57:19.548214 ARP, Request who-has 192.168.56.101 tell 192.168.56.105, length 46
21:57:19.548223 ARP, Reply 192.168.56.101 is-at 08:00:27:f3:3c:c8, length 28
21:57:20.572686 ARP, Request who-has 192.168.56.101 tell 192.168.56.105, length 46
21:57:20.572696 ARP, Reply 192.168.56.101 is-at 08:00:27:f3:3c:c8, length 28
21:57:22.364367 ARP, Request who-has 192.168.56.101 tell 192.168.56.105, length 46
21:57:22.364376 ARP, Reply 192.168.56.101 is-at 08:00:27:f3:3c:c8, length 28
21:57:23.388458 ARP, Request who-has 192.168.56.101 tell 192.168.56.105, length 46
21:57:23.388476 ARP, Reply 192.168.56.101 is-at 08:00:27:f3:3c:c8, length 28
21:57:24.413724 ARP, Request who-has 192.168.56.101 tell 192.168.56.105, length 46
21:57:24.413747 ARP, Reply 192.168.56.101 is-at 08:00:27:f3:3c:c8, length 28
21:57:26.460551 ARP, Request who-has 192.168.56.101 tell 192.168.56.105, length 46
21:57:26.460562 ARP, Reply 192.168.56.101 is-at 08:00:27:f3:3c:c8, length 28
21:57:27.484277 ARP, Request who-has 192.168.56.101 tell 192.168.56.105, length 46
21:57:27.484286 ARP, Reply 192.168.56.101 is-at 08:00:27:f3:3c:c8, length 28
21:57:40.517949 ARP, Request who-has 192.168.56.103 (08:00:27:c1:70:70) tell 192.168.56.1, length 46
21:57:40.517985 ARP, Reply 192.168.56.103 is-at 08:00:27:c1:70:70, length 46
^C
38 packets captured
368 packets received by filter
0 packets dropped by kernel
```

**Comment by 230500226** [comment]
furthermore
```
ubuntu@ubuntu-VirtualBox:~$ sudo tcpdump -n -i enp0s3 icmp
tcpdump: verbose output suppressed, use -v[v]... for full protocol decode
listening on enp0s3, link-type EN10MB (Ethernet), snapshot length 262144 bytes
22:00:15.609270 IP 192.168.56.101 > 192.168.56.105: ICMP echo request, id 3532, seq 1, length 64
22:00:16.649049 IP 192.168.56.101 > 192.168.56.105: ICMP echo request, id 3532, seq 2, length 64
22:00:17.673125 IP 192.168.56.101 > 192.168.56.105: ICMP echo request, id 3532, seq 3, length 64
22:00:17.677431 IP 192.168.56.105 > 192.168.56.101: ICMP echo reply, id 3532, seq 3, length 64
22:00:18.674133 IP 192.168.56.101 > 192.168.56.105: ICMP echo request, id 3532, seq 4, length 64
22:00:19.721095 IP 192.168.56.101 > 192.168.56.105: ICMP echo request, id 3532, seq 5, length 64
22:00:20.745091 IP 192.168.56.101 > 192.168.56.105: ICMP echo request, id 3532, seq 6, length 64
^C
7 packets captured
164 packets received by filter
0 packets dropped by kernel
```

```
ubuntu@ubuntu-VirtualBox:~$ ping -c 6 192.168.56.105
PING 192.168.56.105 (192.168.56.105) 56(84) bytes of data.
64 bytes from 192.168.56.105: icmp_seq=3 ttl=64 time=4.32 ms

--- 192.168.56.105 ping statistics ---
6 packets transmitted, 1 received, 83.3333% packet loss, time 5136ms
rtt min/avg/max/mdev = 4.323/4.323/4.323/0.000 ms
```
